
"R" letter,logomeaning/Letter_R.jpg,It is the Railways Society Integrator! Our purpose is make all railway content useful for all Internet users.

The main content is railway. It isn't only "grown-up" railways, but others: "small" railways, tramways, metro (or "underground", or "subway") and pneumatic metro (metro-on-tires), metrotrams, spitzbus and exc.
"S" letter,logomeaning/Letter_S.jpg,There are also schemes and railways systems. It's more difficult and also the most interesting part. That systems includes different categories: from all-year useable through like as the museum's objects and abandoned to already non-existed. All information about it you find at articles, mono- and polygraph works, archives and museum exhibitions, documentaries, films, books and chronicles.
"I" letter,logomeaning/Letter_I.jpg,It is more than only popular science and humanitarian contents are able in RSI!

There are also many technical and technological parts for specialists from electrical to mechanical systems.

And the main part: RSI includes all lifelines aspects of engineers and developers without whom railway transports wouldn't be able in our world.
